mailru_agent, Mail.ru Agent, file_id, file_idQ_PROTO_MAILRU_AGENT, bytes, "Exchanged file identifier"
mailru_agent, Mail.ru Agent, msg_receiver, msg_receiverQ_PROTO_MAILRU_AGENT, bytes, "The person who chat or voice is done with"
mailru_agent, Mail.ru Agent, msg, msgQ_PROTO_MAILRU_AGENT, bytes, "Exchanged message during a chat"
mailru_agent, Mail.ru Agent, conference_id, conference_idQ_PROTO_MAILRU_AGENT, bytes, "Dialog session identifier, constant during a same session"
mailru_agent, Mail.ru Agent, im_action, im_actionQ_PROTO_MAILRU_AGENT, bytes, "Action of the user."
mailru_agent, Mail.ru Agent, user, userQ_PROTO_MAILRU_AGENT, bytes, "Application user name."
maktoob, Maktoob mail, login, loginQ_PROTO_MAKTOOB, bytes, "User's login string."
maktoob, Maktoob mail, name, nameQ_PROTO_MAKTOOB, bytes, "User's full name."
maktoob, Maktoob mail, msglist_sender, msglist_senderQ_PROTO_MAKTOOB, bytes, "Full address of email sender (alias and email address)."
maktoob, Maktoob mail, msglist_sender_alias, msglist_sender_aliasQ_PROTO_MAKTOOB, bytes, "Name of email sender."
maktoob, Maktoob mail, msglist_receiver, msglist_receiverQ_PROTO_MAKTOOB, bytes, "Full address of email receiver in a message list."
maktoob, Maktoob mail, msglist_receiver_alias, msglist_receiver_aliasQ_PROTO_MAKTOOB, bytes, "Name of email receiver."
maktoob, Maktoob mail, msglist_subject, msglist_subjectQ_PROTO_MAKTOOB, bytes, "Message subject in a message list."
maktoob, Maktoob mail, msglist_date, msglist_dateQ_PROTO_MAKTOOB, bytes, "Message date in a message list."
maktoob, Maktoob mail, msglist_size, msglist_sizeQ_PROTO_MAKTOOB, bytes, "Message size in a message list."
maktoob, Maktoob mail, msglist_folder, msglist_folderQ_PROTO_MAKTOOB, bytes, "Indicates the directory from a message list."
maktoob, Maktoob mail, sender, senderQ_PROTO_MAKTOOB, bytes, "Full address of email sender (alias followed by email address)."
maktoob, Maktoob mail, sender_email, sender_emailQ_PROTO_MAKTOOB, bytes, "Email address of the email sender."
maktoob, Maktoob mail, sender_alias, sender_aliasQ_PROTO_MAKTOOB, bytes, "Name of the email sender."
maktoob, Maktoob mail, receiver, receiverQ_PROTO_MAKTOOB, bytes, "Full address of email receiver (including cc and bcc receivers)."
maktoob, Maktoob mail, receiver_alias, receiver_aliasQ_PROTO_MAKTOOB, bytes, "Name of email receiver (included cc and bcc receivers)."
maktoob, Maktoob mail, receiver_email, receiver_emailQ_PROTO_MAKTOOB, bytes, "Email address of message receiver (included cc and bcc receivers)."
maktoob, Maktoob mail, receiver_type, receiver_typeQ_PROTO_MAKTOOB, bytes, "Type of the email receiver."
maktoob, Maktoob mail, replyto, replytoQ_PROTO_MAKTOOB, bytes, "Email address to use in a reply for this message."
maktoob, Maktoob mail, date, dateQ_PROTO_MAKTOOB, bytes, "Message date."
maktoob, Maktoob mail, subject, subjectQ_PROTO_MAKTOOB, bytes, "Message subject."
maktoob, Maktoob mail, attach_id, attach_idQ_PROTO_MAKTOOB, bytes, "Attachment identifier."
maktoob, Maktoob mail, attach_filename, attach_filenameQ_PROTO_MAKTOOB, bytes, "Attachment name."
maktoob, Maktoob mail, attach_type, attach_typeQ_PROTO_MAKTOOB, bytes, "Content type of the sent attached file."
maktoob, Maktoob mail, attach_size, attach_sizeQ_PROTO_MAKTOOB, uint32, "Attached file MIME size."
maktoob, Maktoob mail, msg_id, msg_idQ_PROTO_MAKTOOB, bytes, "Identifier of the message."
maktoob, Maktoob mail, draft, draftQ_PROTO_MAKTOOB, uint32, "Indicates if the email is a draft or has really been posted"
maktoob, Maktoob mail, encoding, encodingQ_PROTO_MAKTOOB, bytes, "Page encoding"
maktoob, Maktoob mail, folder, folderQ_PROTO_MAKTOOB, bytes, "Indicates the directory from where messages are read."
maktoob, Maktoob mail, action, actionQ_PROTO_MAKTOOB, bytes, "Indicates if the message is read (Read) or composed (Compose)."
maktoob, Maktoob mail, contact_email, contact_emailQ_PROTO_MAKTOOB, bytes, "Email address of a contact."
maktoob, Maktoob mail, contact_alias, contact_aliasQ_PROTO_MAKTOOB, bytes, "Alias of a contact."
maktoob, Maktoob mail, contact, contactQ_PROTO_MAKTOOB, bytes, "Complete contact."
maktoob, Maktoob mail, session_id, session_idQ_PROTO_MAKTOOB, bytes, "Uniquely identifies the current user session."
mandriva_update, Mandriva Update, package_name, package_nameQ_PROTO_MANDRIVA_UPDATE, bytes, "Name of the downloaded package."
mandriva_update, Mandriva Update, package_version, package_versionQ_PROTO_MANDRIVA_UPDATE, bytes, "Version number of the downloaded package."
mandriva_update, Mandriva Update, package_archi, package_archiQ_PROTO_MANDRIVA_UPDATE, bytes, "Archi of package."
mandriva_update, Mandriva Update, package_distrib, package_distribQ_PROTO_MANDRIVA_UPDATE, bytes, "Version of the currently upgraded-distribution"
mapi, MS Exchange Message API, login, loginQ_PROTO_MAPI, bytes, "User's login string."
mapi, MS Exchange Message API, login_server, login_serverQ_PROTO_MAPI, bytes, "Concatenated login and server: <login>@<server>."
mapi, MS Exchange Message API, host, hostQ_PROTO_MAPI, bytes, "Client's hostname."
mapi, MS Exchange Message API, domain, domainQ_PROTO_MAPI, bytes, "Network domain of the client."
mapi, MS Exchange Message API, action, actionQ_PROTO_MAPI, bytes, "Indicates if the message is read (Read) or composed (Compose)."
mapi, MS Exchange Message API, importance, importanceQ_PROTO_MAPI, uint32, "Indicates if the email has been marked by the user."
mapi, MS Exchange Message API, sensivity, sensivityQ_PROTO_MAPI, uint32, "Message sensibility."
mapi, MS Exchange Message API, date, dateQ_PROTO_MAPI, uint64, "Message date: number of 100-nanosecond intervals since January 1, 1601."
mapi, MS Exchange Message API, size, sizeQ_PROTO_MAPI, uint32, "Message size."
mapi, MS Exchange Message API, flags, flagsQ_PROTO_MAPI, uint32, "Message flags."
mapi, MS Exchange Message API, email_type, email_typeQ_PROTO_MAPI, bytes, "E-mail type (enumeration)."
mapi, MS Exchange Message API, receiver_type, receiver_typeQ_PROTO_MAPI, bytes, "Type of the email receiver."
mapi, MS Exchange Message API, attach_id, attach_idQ_PROTO_MAPI, uint32, "Attachment identifier."
mapi, MS Exchange Message API, msglist_date, msglist_dateQ_PROTO_MAPI, uint64, "Message date in a message list: number of 100-nanosecond intervals since January 1, 1601."
mapi, MS Exchange Message API, msglist_msgid, msglist_msgidQ_PROTO_MAPI, uint64, "Message identifier."
mapi, MS Exchange Message API, msglist_size, msglist_sizeQ_PROTO_MAPI, uint32, "Message size in a message list."
mapi, MS Exchange Message API, msglist_importance, msglist_importanceQ_PROTO_MAPI, uint32, "Indicates if the message has been marked by the user."
mapi, MS Exchange Message API, msglist_sensivity, msglist_sensivityQ_PROTO_MAPI, uint32, "Message sensibility in a message list."
mapi, MS Exchange Message API, msglist_flags, msglist_flagsQ_PROTO_MAPI, uint32, "Message flags in a message list."
mapi, MS Exchange Message API, msglist_receiver_type, msglist_receiver_typeQ_PROTO_MAPI, bytes, "Type of the email receiver"
mashare, Ma-Share.com, action, actionQ_PROTO_MASHARE, bytes, "Indicates the action executed by the user."
mashare, Ma-Share.com, filename, filenameQ_PROTO_MASHARE, bytes, "Name of the transferred file."
mashare, Ma-Share.com, filesize, filesizeQ_PROTO_MASHARE, uint32, "Size (byte) of the transferred file."
mashare, Ma-Share.com, download_url, download_urlQ_PROTO_MASHARE, bytes, "Link of the downloaded file."
mashare, Ma-Share.com, delete_url, delete_urlQ_PROTO_MASHARE, bytes, "Link to use in order to delete the file."
mashare, Ma-Share.com, fileid, fileidQ_PROTO_MASHARE, bytes, "Unique identifier of the file."
mgcp, Media Gateway Control Protocol, method, methodQ_PROTO_MGCP, bytes, "The command"
mgcp, Media Gateway Control Protocol, endpoint, endpointQ_PROTO_MGCP, bytes, "Handset identifier"
mgcp, Media Gateway Control Protocol, version, versionQ_PROTO_MGCP, bytes, "Protocol version"
mgcp, Media Gateway Control Protocol, tid, tidQ_PROTO_MGCP, uint32, "Transaction identifier"
mgcp, Media Gateway Control Protocol, code, codeQ_PROTO_MGCP, uint32, "Return code of a query"
mgcp, Media Gateway Control Protocol, packets_sent, packets_sentQ_PROTO_MGCP, uint32, "Number of RTP packets sent"
mgcp, Media Gateway Control Protocol, octets_sent, octets_sentQ_PROTO_MGCP, uint32, "Number of RTP octets sent"
mgcp, Media Gateway Control Protocol, packets_received, packets_receivedQ_PROTO_MGCP, uint32, "Number of RTP packets received"
mgcp, Media Gateway Control Protocol, octets_received, octets_receivedQ_PROTO_MGCP, uint32, "Number of RTP octets received"
mgcp, Media Gateway Control Protocol, packets_lost, packets_lostQ_PROTO_MGCP, uint32, "Number of lost RTP packets"
mgcp, Media Gateway Control Protocol, jitter, jitterQ_PROTO_MGCP, uint32, "Observed Jitter for RTP packets"
mgcp, Media Gateway Control Protocol, latency, latencyQ_PROTO_MGCP, uint32, "Observed latency for RTP packets"
mgcp, Media Gateway Control Protocol, call_duration, call_durationQ_PROTO_MGCP, string, "Call duration."
mgcp, Media Gateway Control Protocol, session_duration, session_durationQ_PROTO_MGCP, string, "Call setup duration."
mgcp, Media Gateway Control Protocol, phone_number, phone_numberQ_PROTO_MGCP, bytes, "The phone number."
mgcp, Media Gateway Control Protocol, event, eventQ_PROTO_MGCP, bytes, "Observed events"
mgcp, Media Gateway Control Protocol, message_type, message_typeQ_PROTO_MGCP, bytes, "The message type"
mgcp, Media Gateway Control Protocol, call_way, call_wayQ_PROTO_MGCP, bytes, "The call Way (In, Out)"
mgcp, Media Gateway Control Protocol, start_time, start_timeQ_PROTO_MGCP, string, "Start date of the call."
mgcp, Media Gateway Control Protocol, mode, modeQ_PROTO_MGCP, bytes, "Contains the connection mode (sendrcv, recvonly, ...)"
mgcp, Media Gateway Control Protocol, notifiedEntity, notifiedEntityQ_PROTO_MGCP, bytes, "Contains the identity of the notified identity"
mgcp, Media Gateway Control Protocol, media_type, media_typeQ_PROTO_MGCP, bytes, "Contains the media type."
mgcp, Media Gateway Control Protocol, media_proto, media_protoQ_PROTO_MGCP, bytes, "Protocol used in client stream."
mgcp, Media Gateway Control Protocol, media_format, media_formatQ_PROTO_MGCP, uint32, "Client's protocol formats available."
mgcp, Media Gateway Control Protocol, signal, signalQ_PROTO_MGCP, bytes, "Contains the received/sent signal"
mgcp, Media Gateway Control Protocol, digitmap, digitmapQ_PROTO_MGCP, bytes, "Contains the digitmap"
mgcp, Media Gateway Control Protocol, caller, callerQ_PROTO_MGCP, bytes, "Contains the identity (or the phone number) of the initiator of the call."
mgcp, Media Gateway Control Protocol, callee, calleeQ_PROTO_MGCP, bytes, "Contains the identity (or the phone number) of the called party for a call."
mgcp, Media Gateway Control Protocol, connection_id, connection_idQ_PROTO_MGCP, bytes, "Connection identifier"
mgcp, Media Gateway Control Protocol, media_attr_type, media_attr_typeQ_PROTO_MGCP, uint32, "Contains the media type (audio or video)."
mgcp, Media Gateway Control Protocol, media_attr_encoding, media_attr_encodingQ_PROTO_MGCP, bytes, "The encoding of media data."
mgcp, Media Gateway Control Protocol, media_attr_rate, media_attr_rateQ_PROTO_MGCP, bytes, "The encoding rate."
mgcp, Media Gateway Control Protocol, media_attr_param, media_attr_paramQ_PROTO_MGCP, bytes, "Session attribute value."
mgcp, Media Gateway Control Protocol, media_attr_label, media_attr_labelQ_PROTO_MGCP, bytes, "Name of the described session attribute."
mgcp, Media Gateway Control Protocol, media_attr_addr, media_attr_addrQ_PROTO_MGCP, string, "The mentioned IPv4 address to be used."
mgcp, Media Gateway Control Protocol, media_attr_channel, media_attr_channelQ_PROTO_MGCP, bytes, "The channel value."
mgcp, Media Gateway Control Protocol, media_attr_transport, media_attr_transportQ_PROTO_MGCP, bytes, "The transport protocol (TCP or UDP)."
mgcp, Media Gateway Control Protocol, media_attr_value, media_attr_valueQ_PROTO_MGCP, bytes, "Line value of the media attribute."
mgcp, Media Gateway Control Protocol, call_id, call_idQ_PROTO_MGCP, bytes, "Call id, extracted for each call."
mimp, IMP mobile version, attach_filename, attach_filenameQ_PROTO_MIMP, bytes, "Attachment name."
mimp, IMP mobile version, date, dateQ_PROTO_MIMP, bytes, "Message date."
mimp, IMP mobile version, sender_alias, sender_aliasQ_PROTO_MIMP, bytes, "Name of the email sender."
mimp, IMP mobile version, sender_email, sender_emailQ_PROTO_MIMP, bytes, "Email address of the email sender."
mimp, IMP mobile version, sender, senderQ_PROTO_MIMP, bytes, "Full address of email sender (alias followed by email address)."
mimp, IMP mobile version, subject, subjectQ_PROTO_MIMP, bytes, "Message subject."
mimp, IMP mobile version, receiver_type, receiver_typeQ_PROTO_MIMP, bytes, "Type of the email receiver."
mimp, IMP mobile version, receiver_alias, receiver_aliasQ_PROTO_MIMP, bytes, "Name of email receiver (included cc and bcc receivers)."
mimp, IMP mobile version, receiver_email, receiver_emailQ_PROTO_MIMP, bytes, "Email address of message receiver (included cc and bcc receivers)."
mimp, IMP mobile version, receiver, receiverQ_PROTO_MIMP, bytes, "Full address of email receiver (including cc and bcc receivers)."
mimp, IMP mobile version, msglist_subject, msglist_subjectQ_PROTO_MIMP, bytes, "Message subject in a message list."
mimp, IMP mobile version, msglist_sender_alias, msglist_sender_aliasQ_PROTO_MIMP, bytes, "Name of email sender."
mimp, IMP mobile version, msglist_receiver_alias, msglist_receiver_aliasQ_PROTO_MIMP, bytes, "Name of email receiver."
mimp, IMP mobile version, password, passwordQ_PROTO_MIMP, bytes, "User's password string."
mimp, IMP mobile version, login, loginQ_PROTO_MIMP, bytes, "User's login string."
mimp, IMP mobile version, action, actionQ_PROTO_MIMP, bytes, "Indicates if the message is read (Read) or composed (Compose)."
mimp, IMP mobile version, msglist_folder, msglist_folderQ_PROTO_MIMP, bytes, "Indicates the directory from a message list."
mimp, IMP mobile version, attach_size, attach_sizeQ_PROTO_MIMP, uint32, "Attached file MIME size."
mms, Microsoft Multimedia Streaming, filename, filenameQ_PROTO_MMS, bytes, "Name of the file currently broadcasted."
mmse, MultiMedia Messages Encapsulation, receiver, receiverQ_PROTO_MMSE, bytes, "MMS receiver."
mmse, MultiMedia Messages Encapsulation, nb_receiver, nb_receiverQ_PROTO_MMSE, uint32, "Number of receiver for the same MMS."
mmse, MultiMedia Messages Encapsulation, version, versionQ_PROTO_MMSE, bytes, "Protocol version."
mmse, MultiMedia Messages Encapsulation, tid, tidQ_PROTO_MMSE, bytes, "Transaction identifier."
mmse, MultiMedia Messages Encapsulation, sender, senderQ_PROTO_MMSE, bytes, "MMS sender."
mmse, MultiMedia Messages Encapsulation, subject, subjectQ_PROTO_MMSE, bytes, "MMS subject."
mmse, MultiMedia Messages Encapsulation, content_type, content_typeQ_PROTO_MMSE, bytes, "The content type of the message."
mmse, MultiMedia Messages Encapsulation, message_id, message_idQ_PROTO_MMSE, bytes, "A unique reference assigned to the message. The ID enables a client to match delivery reports with previously sent messages."
mmse, MultiMedia Messages Encapsulation, content_location, content_locationQ_PROTO_MMSE, bytes, "Specifies a reference to the stored version of the MM that can be retrieved or can be used to obtain information about the MM using the WSP/HTTP GET or M-Mbox-View-req."
mmse, MultiMedia Messages Encapsulation, response_status_code, response_status_codeQ_PROTO_MMSE, uint32, "It is used by the originating MMS Proxy-Relay to inform the MMS Client, which has performed a submission or a forward the result of that particular operation."
mmse, MultiMedia Messages Encapsulation, response_status_text, response_status_textQ_PROTO_MMSE, bytes, "Description which qualifies the response_status_code. The description may be based on the on the status code names contained in RFC1893."
mmse, MultiMedia Messages Encapsulation, message_sz, message_szQ_PROTO_MMSE, uint32, "Full size of message in octets."
mmse, MultiMedia Messages Encapsulation, content_part_type, content_part_typeQ_PROTO_MMSE, bytes, "Message sub-part type."
mmse, MultiMedia Messages Encapsulation, content_part_id, content_part_idQ_PROTO_MMSE, bytes, "Message sub-part ID."
mmse, MultiMedia Messages Encapsulation, content_part_filename, content_part_filenameQ_PROTO_MMSE, bytes, "Name of the file containing the current message sub-part data."
mount, Mount, flavor, flavorQ_PROTO_MOUNT, uint32, "Authentification supported by the server"
mount, Mount, flavors, flavorsQ_PROTO_MOUNT, uint32, "Number of authentification flavors supported by the server"
mount, Mount, length_fhandle, length_fhandleQ_PROTO_MOUNT, uint32, "Length of the file handle"
mount, Mount, status, statusQ_PROTO_MOUNT, uint32, "Information status on the request process."
mount, Mount, path_value, path_valueQ_PROTO_MOUNT, bytes, "Value of the data path string."
mount, Mount, path_length, path_lengthQ_PROTO_MOUNT, uint32, "Length of the data path string."
mpegts, MPEG-Transport Stream, chunk_len, chunk_lenQ_PROTO_MPEGTS, uint32, "Data length."
mplus_messenger, M+ Messenger, service_id, service_idQ_PROTO_MPLUS_MESSENGER, uint32, "Composite 32-bit integer value defining the service currently used. The first byte (LSB) gives the generic service definition, the second byte gives an advanced service definition for specific cases (example: File Transfer)."
mplus_messenger, M+ Messenger, service, serviceQ_PROTO_MPLUS_MESSENGER, bytes, "Current service identification string."
mplus_messenger, M+ Messenger, service_stats, service_statsQ_PROTO_MPLUS_MESSENGER, bytes, "Composite attribute containing the packet metrics used for each new service type detection, extracting when performing STATISCAL detection method only. Note: this attribute won't be extracted in case of session expiration (eg. when the current service is not ended properly by the user)."
msrp, Message Session Relay Protocol, session_id, session_idQ_PROTO_MSRP, bytes, "Uniquely identifies the current user session."
msrp, Message Session Relay Protocol, authority, authorityQ_PROTO_MSRP, bytes, "Authority part of an MSRP uri"
msrp, Message Session Relay Protocol, uri, uriQ_PROTO_MSRP, bytes, "MSRP uri"
msrp, Message Session Relay Protocol, path_type, path_typeQ_PROTO_MSRP, bytes, "path_entry attribute type."
myspace, MySpace.com, query_raw, query_rawQ_PROTO_MYSPACE, bytes, "Contains the query sent to the search engine as indicated in the URL."
myspace, MySpace.com, query_text, query_textQ_PROTO_MYSPACE, bytes, "Query sent to the search engine."
myspace, MySpace.com, password, passwordQ_PROTO_MYSPACE, bytes, "User's password string."
myspace, MySpace.com, nickname, nicknameQ_PROTO_MYSPACE, bytes, "User's profile displayed name."
myspace, MySpace.com, name, nameQ_PROTO_MYSPACE, bytes, "Name the user."
myspace, MySpace.com, login, loginQ_PROTO_MYSPACE, bytes, "User's login string."
mysql, MySQL Protocol, login, loginQ_PROTO_MYSQL, bytes, "User's login string."
mysql, MySQL Protocol, base, baseQ_PROTO_MYSQL, bytes, "Database name."
mysql, MySQL Protocol, query, queryQ_PROTO_MYSQL, bytes, "SQL query."
nbns, Netbios Name Service, service, serviceQ_PROTO_NBNS, bytes, "Current service identification string."
nbns, Netbios Name Service, query, queryQ_PROTO_NBNS, bytes, "Query sent."
netbios, Netbios, caller, callerQ_PROTO_NETBIOS, bytes, "Name of the caller."
netbios, Netbios, callee, calleeQ_PROTO_NETBIOS, bytes, "Name of the called member."
netbsd_update, NetBSD Updates, package_name, package_nameQ_PROTO_NETBSD_UPDATE, bytes, "Software package name."
netflix, Netflix.com, login, loginQ_PROTO_NETFLIX, bytes, "User's login string."
netflix, Netflix.com, video_duration, video_durationQ_PROTO_NETFLIX, bytes, "Duration of the video in seconds."
netflix, Netflix.com, videoid, videoidQ_PROTO_NETFLIX, bytes, "Netflix video identifier."
netflix, Netflix.com, title, titleQ_PROTO_NETFLIX, bytes, "Title of the movie."
netflix, Netflix.com, description, descriptionQ_PROTO_NETFLIX, bytes, "Synopsis of the movie."
netflix, Netflix.com, date, dateQ_PROTO_NETFLIX, bytes, "Release date of the movie."
netlog, Netlog.com, login, loginQ_PROTO_NETLOG, bytes, "User's login string."
netlog, Netlog.com, password, passwordQ_PROTO_NETLOG, bytes, "User's password string."
netlog, Netlog.com, is_mobile_service, is_mobile_serviceQ_PROTO_NETLOG, uint32, "Whether or not the access was made through a mobile device."
nfs, Network File System, version, versionQ_PROTO_NFS, bytes, "Used version"
nfs, Network File System, filename, filenameQ_PROTO_NFS, bytes, "Accessed, written or read file name."
nfs, Network File System, offset, offsetQ_PROTO_NFS, uint64, "Offset of the written/read file. Extracted on READ and WRITE procedure replies."
nfs, Network File System, filesize, filesizeQ_PROTO_NFS, uint64, "Size of the file."
nfs, Network File System, uid, uidQ_PROTO_NFS, uint32, "Generic user ID."
nfs, Network File System, gid, gidQ_PROTO_NFS, uint32, "Identifier of the file owner's group (see page 21 of RFC 1813)."
nfs, Network File System, mode, modeQ_PROTO_NFS, uint32, "Protection mode bits (see page 22 of RFC 1813)."
nfs, Network File System, type_string, type_stringQ_PROTO_NFS, bytes, "File type (see page 19 of RFC 1813)."
niconico_douga, Nicovideo.jp (aka Nico Nico Douga), query_text, query_textQ_PROTO_NICONICO_DOUGA, bytes, "Decoded query text."
niconico_douga, Nicovideo.jp (aka Nico Nico Douga), query_raw, query_rawQ_PROTO_NICONICO_DOUGA, bytes, "Query in raw HTML"
niconico_douga, Nicovideo.jp (aka Nico Nico Douga), video_duration, video_durationQ_PROTO_NICONICO_DOUGA, bytes, "Duration of the video in seconds."
niconico_douga, Nicovideo.jp (aka Nico Nico Douga), videoid, videoidQ_PROTO_NICONICO_DOUGA, bytes, "Nico nico video identifier."
niconico_douga, Nicovideo.jp (aka Nico Nico Douga), tag, tagQ_PROTO_NICONICO_DOUGA, bytes, "Video tag."
niconico_douga, Nicovideo.jp (aka Nico Nico Douga), title, titleQ_PROTO_NICONICO_DOUGA, bytes, "Title of the video."
niconico_douga, Nicovideo.jp (aka Nico Nico Douga), description, descriptionQ_PROTO_NICONICO_DOUGA, bytes, "Synopsis of the video."
niconico_douga, Nicovideo.jp (aka Nico Nico Douga), date, dateQ_PROTO_NICONICO_DOUGA, bytes, "Release date of the video."
niconico_douga, Nicovideo.jp (aka Nico Nico Douga), nickname, nicknameQ_PROTO_NICONICO_DOUGA, bytes, "User nickname."
niconico_douga, Nicovideo.jp (aka Nico Nico Douga), login, loginQ_PROTO_NICONICO_DOUGA, bytes, "User's login string."
nntp, Network News Transport Protocol, sender, senderQ_PROTO_NNTP, bytes, "Full address of email sender (alias followed by email address)."
nntp, Network News Transport Protocol, login, loginQ_PROTO_NNTP, bytes, "User's login string."
nntp, Network News Transport Protocol, password, passwordQ_PROTO_NNTP, bytes, "User's password string."
nntp, Network News Transport Protocol, newsgroup, newsgroupQ_PROTO_NNTP, bytes, "Newsgroup name."
nntp, Network News Transport Protocol, subject, subjectQ_PROTO_NNTP, bytes, "Message subject."
nntp, Network News Transport Protocol, header_raw, header_rawQ_PROTO_NNTP, bytes, "One NNTP header line (field and value)."
nntp, Network News Transport Protocol, attach_filename, attach_filenameQ_PROTO_NNTP, bytes, "Attachment name."
ntp, Network Time Protocol, reference_clock, reference_clockQ_PROTO_NTP, string, "Reference clock IP address."
odnoklassniki, Odnoklassniki.ru, contact_alias, contact_aliasQ_PROTO_ODNOKLASSNIKI, bytes, "Alias of a contact."
odnoklassniki, Odnoklassniki.ru, group_name, group_nameQ_PROTO_ODNOKLASSNIKI, bytes, "Name of the group the user has subscribed to."
odnoklassniki, Odnoklassniki.ru, password, passwordQ_PROTO_ODNOKLASSNIKI, bytes, "User's password string."
odnoklassniki, Odnoklassniki.ru, login, loginQ_PROTO_ODNOKLASSNIKI, bytes, "User's login string."
oovoo, Oovoo, login, loginQ_PROTO_OOVOO, bytes, "User's login string."
openbsd_update, OpenBSD Updates, package_name, package_nameQ_PROTO_OPENBSD_UPDATE, bytes, "Software package name."
openvpn, OpenVPN, seq, seqQ_PROTO_OPENVPN, uint32, "Sequence number"
opera_update, Opera Update, new_version, new_versionQ_PROTO_OPERA_UPDATE, bytes, "New version of Opera which will be installed."
opera_update, Opera Update, current_version, current_versionQ_PROTO_OPERA_UPDATE, bytes, "Opera version currently installed."
orangemail, Orange webmail, draft, draftQ_PROTO_ORANGEMAIL, uint32, "Indicates if the email is a draft or has really been posted"
orangemail, Orange webmail, attach_id, attach_idQ_PROTO_ORANGEMAIL, bytes, "Attachment identifier."
orangemail, Orange webmail, attach_filename, attach_filenameQ_PROTO_ORANGEMAIL, bytes, "Attachment name."
orangemail, Orange webmail, date, dateQ_PROTO_ORANGEMAIL, bytes, "Message date."
orangemail, Orange webmail, receiver_type, receiver_typeQ_PROTO_ORANGEMAIL, bytes, "Type of the email receiver."
orangemail, Orange webmail, receiver_alias, receiver_aliasQ_PROTO_ORANGEMAIL, bytes, "Name of email receiver (included cc and bcc receivers)."
orangemail, Orange webmail, receiver_email, receiver_emailQ_PROTO_ORANGEMAIL, bytes, "Email address of message receiver (included cc and bcc receivers)."
orangemail, Orange webmail, receiver, receiverQ_PROTO_ORANGEMAIL, bytes, "Full address of email receiver (including cc and bcc receivers)."
orangemail, Orange webmail, sender_alias, sender_aliasQ_PROTO_ORANGEMAIL, bytes, "Name of the email sender."
orangemail, Orange webmail, sender_email, sender_emailQ_PROTO_ORANGEMAIL, bytes, "Email address of the email sender."
orangemail, Orange webmail, sender, senderQ_PROTO_ORANGEMAIL, bytes, "Full address of email sender (alias followed by email address)."
orangemail, Orange webmail, subject, subjectQ_PROTO_ORANGEMAIL, bytes, "Message subject."
orangemail, Orange webmail, msg_id, msg_idQ_PROTO_ORANGEMAIL, bytes, "Identifier of the message."
